Bloc,Sujet,Contenu à transmettre,Responsable,Statut,Notes
Mission,Nom de la mission / client,"Novaxis - structuration management",Consultant senior,A completer,
Contexte,Problème central,"Trop de validations remontent au dirigeant",Dirigeant,A completer,
Jalons,Dates clés,"Atelier 2 le 10/07, restitution le 18/07",Office manager,A completer,
Données,Documents utiles,"Org chart, pipeline, planning equipe, CA mensuel",Consultant,A completer,
Décisions,Arbitrages deja pris,"Commencer par grille d'autorite puis pilotage commercial",Dirigeant,A completer,
Prochaine action,Etape suivante,"Preparer atelier delegation avec exemples concrets",Consultant senior,A completer,
Contacts,Interlocuteurs utiles,"CEO, bras droit, responsable commercial",Office manager,A completer,
