Bloc,Élément,Emplacement,Responsable,Fréquence de contrôle,Statut,Notes
Bail,Bail et annexes signés,Dossier location,Responsable admin,Hebdomadaire,A verifier,
EDL,États des lieux entrée / sortie,Dossier location,Responsable gestion,Hebdomadaire,A verifier,
Diagnostics,Diagnostics et pièces réglementaires,Dossier bien,Responsable gestion,Mensuel,A verifier,
Affichages,Informations obligatoires et honoraires,Supports location,Responsable admin,Mensuel,A verifier,
Archivage,Dossier complet et traçable,Arborescence gestion,Responsable admin,Mensuel,A verifier,
