Bloc,Sujet,Emplacement,Responsable,Acces,Vérification,Notes
Outils,Messagerie et agenda,Google Workspace / Outlook,Dirigeant,Equipe autorisee,Mensuel,"Verifier acces entrants / sortants"
Copropriété,Dossiers immeubles et lots,Base copro / Drive,Responsable copro,Equipe copro,Hebdomadaire,"Source unique patrimoine"
AG,PV, resols et convocations,Dossier AG,Responsable copro,Equipe concernée,Mensuel,"Historique centralise"
Finance,Appels de fonds, reglements et impayes,Tableau administratif,Responsable admin,Direction + admin,Hebdomadaire,"Base relances"
Conformité,Contrats et pièces réglementaires,Dossier conformite,Responsable copro,Direction + admin,Mensuel,"Assurances, contrats, docs obligatoires"
Continuite,Contacts conseil syndical / artisans,Fiche contacts critiques,Responsable admin,Equipe cle,Mensuel,"Interlocuteurs récurrents"
