Étape,Sujet,Responsable,Statut attendu,Échéance,Notes
Copropriété,Dossier immeuble complet,Responsable copro,Fait,Avant prise en charge,
Lots,Informations clés et interlocuteurs recenses,Responsable copro,Fait,Sous 48h,
Entretien,Carnet d'entretien mis a jour,Responsable copro,Fait,Sous 7 jours,
Contrats,Prestataires et assurances archivés,Responsable admin,Fait,Sous 7 jours,
Suivi,Dossier copropriété cree dans arborescence unique,Responsable admin,Fait,Immediat,
Suivi,Date prochaine revue copro planifiee,Responsable copro,Fait,Immediat,
