Bloc,Sujet,Contenu à transmettre,Responsable,Statut,Notes
Dossier,Nom du client / sujet,"PME Atlas - correction contrat de travail",Referent RH,A completer,
Contexte,Objet,"Contrat a ajuster avant signature salarie",Responsable operations,A completer,
Échéances,Dates clés,"Retour client attendu le 07/07",Responsable operations,A completer,
Pièces,Documents indispensables,"Projet contrat, brief manager, convention collective",Referent RH,A completer,
Décisions,Arbitrages deja pris,"Conserver package, ajuster clauses variables",Dirigeant,A completer,
Prochaine action,Etape suivante,"Envoyer V2 au client pour validation",Referent RH,A completer,
Contacts,Interlocuteurs utiles,"Dirigeant client, manager, contact RH interne",Responsable admin,A completer,
