Canal,Contact,Type de dossier,Besoin identifié,Prochaine action,Responsable,Échéance,Statut,Notes
Prescripteur,Maître Lefevre,"Contentieux commercial","Recherche d'un cabinet pour PME",Appeler pour cadrer le dossier,Associe gerant,2026-07-10,A relancer,"A deja recommande 2 clients"
Recommandation client,Dirigeante SARL Horizon,"Droit social","Besoin d'accompagnement rupture conventionnelle",Envoyer liste des pieces,Avocat referent,2026-07-08,En cours,"Appel realise"
LinkedIn,Directeur juridique Novaxis,"Contrat fournisseur","Veut revoir les clauses de responsabilite",Programmer visio de 20 min,Associe gerant,2026-07-12,A qualifier,"Contact obtenu via message"
Reseau local,Expert-comptable Martin,"Recouvrement","Client avec impaye important",Envoyer trame d'offre cabinet,Assistante juridique,2026-07-09,A envoyer,"Prescripteur actif"
Ancien client,Societe Atlas,"Bail commercial","Question sur renouvellement et loyer",Relancer si pas de retour,Avocat referent,2026-07-11,Proposition envoyee,"Dossier deja traite en 2025"
