Bloc,Sujet,Contenu à transmettre,Responsable,Statut,Notes
Dossier,Nom du dossier / client,"Societe Atlas - contentieux commercial",Avocat referent,A completer,
Contexte,Objet,"Litige fournisseur avec assignation en preparation",Avocat referent,A completer,
Échéances,Dates clés,"Conclusions a envoyer au 11/07, point client le 09/07",Assistante juridique,A completer,
Pièces,Documents indispensables,"Contrat cadre, mails, facture contestee, projet conclusions",Juriste,A completer,
Décisions,Arbitrages deja pris,"Option contentieuse retenue, pas de transaction a ce stade",Associe gerant,A completer,
Prochaine action,Etape suivante,"Finaliser conclusions et envoyer validation finale",Avocat referent,A completer,
Contacts,Interlocuteurs utiles,"Cliente, huissier, confrere adverse",Assistante juridique,A completer,
