Étape,Sujet,Objectif,Responsable,Échéance,Statut,Notes
Jour 1,Accueil et presentation cabinet,Comprendre le positionnement et les regles du cabinet,Associe gerant,Jour 1,A faire,
Jour 1,Acces outils et dossiers,Pouvoir travailler sans blocage technique,Assistante juridique,Jour 1,A faire,
Semaine 1,Process ouverture dossier,Savoir ouvrir un dossier proprement,Avocat referent,Semaine 1,A faire,
Semaine 1,Agenda et echeances,Ne jamais rater une date cle,Assistante juridique,Semaine 1,A faire,
Semaine 2,Qualite redaction et validations,Comprendre le niveau d'exigence avant envoi,Associe gerant,Semaine 2,A faire,
Semaine 3,Autonomie sur un premier dossier,Prendre un sujet simple avec supervision,Avocat referent,Semaine 3,A faire,
Mois 1,Bilan integration,Verifier les points acquis et les blocages,Associe gerant,Fin mois 1,A planifier,
