Etape,Objectif,Point de controle,Responsable,Statut,Notes
Prise de rendez-vous,Donner un cadre clair,"Motif, duree, praticien, consigne avant venue",Responsable accueil,A faire,
Confirmation,Limiter les oublis,"SMS / email 24h avant",Responsable accueil,A faire,
Accueil,Fluidifier l'arrivee,"Verifier identite, dossier, retard, paiement si besoin",Assistante,A faire,
Consultation / soin,Lancer sans flottement,"Dossier pret, salle prete, praticien informe",Praticien,A faire,
Fin de prise en charge,Clore proprement,"Compte rendu, prochaine etape, document remis",Praticien,A faire,
Post-consultation,Securiser le suivi,"Facture, feuille de soin, prochain RDV si besoin",Assistante,A faire,
