Partenaire,Rôle,Dossier concerné,Contact,Remplaçant / backup,Passation clé,Notes
Notaire Duval,Actes et signatures,Immeuble Lille,03 20 00 00 00,Notaire Leroy,"Calendrier signature, pièces manquantes",Prioritaire
Cabinet ABC,Expertise travaux,T2 Nantes,06 10 10 10 10,Entreprise Reno 44,"Dernier devis, points techniques sensibles",A conserver
Banque Horizon,Financement portefeuille,SCI Reims,01 44 00 00 00,Courtier Martin,"Accord en cours, pièces à fournir",Suivi hebdo
Gestionnaire locatif externe,Relocation,Maison Angers,07 50 00 00 00,Responsable portefeuille,"Annonce, visites, grille loyers",A cadrer
Comptable partenaire,Suivi fiscal,Sociétés du groupe,01 55 00 00 00,Responsable admin,"Dates déclaratives, arbitrages fiscaux",Mensuel
