Étape,Sujet,Objectif,Responsable,Échéance,Statut,Notes
Jour 1,Accueil et positionnement,Comprendre l'offre et le type de chantiers,Dirigeant,Jour 1,A faire,
Jour 1,Accès outils et documents,Pouvoir retrouver plans et infos chantier,Responsable admin,Jour 1,A faire,
Semaine 1,Démarrage chantier et sécurité,Savoir lancer un chantier proprement,Conducteur de travaux,Semaine 1,A faire,
Semaine 1,Suivi avancement et remontée aléas,Comprendre quoi tracer et quand alerter,Conducteur de travaux,Semaine 1,A faire,
Semaine 2,Standards qualité et réception,Comprendre le niveau attendu avant réception,Chef d'equipe,Semaine 2,A faire,
Semaine 3,Premier sujet en autonomie partielle,Prendre un lot ou une tâche avec supervision,Conducteur de travaux,Semaine 3,A faire,
Mois 1,Bilan intégration,Valider autonomie et points de vigilance,Dirigeant,Fin mois 1,A planifier,
